tweet_id,user,text,created at,location,sentiment
1247619046901604353,glennirvinem,“Speaking Moistly” will be the title of someone’s Coronavirus poetry anthology. https://t.co/x6UHpT1BcM,2020-04-07 20:15:35,United States,neutral
1247619062475239424,TeresaKennedy,"A nice place to cook food for everyone is what we need during this quarantine! 

For your real estate concerns pkease call us now! We are here to help!!

Teresa Kennedy
281.799.3927

#communityquarantine… https://t.co/19yuGTQkDY",2020-04-07 20:15:38,United States,neutral
1247619121409335299,a_terry10,I’d rather get coronavirus than walk around a public place with a construction mask on,2020-04-07 20:15:52,United States,negative
1247619139151302656,IAMNYO,"Here practicing my beat making https://t.co/UBWMe8aanI time like the present  #beatmaking #beatmaker #musiclover #producerinthemaking #quarantine #stayhomestaysafe @ San Juan, Trinidad and Tobago https://t.co/mbTZMLfkeT",2020-04-07 20:15:57,Trinidad and Tobago,neutral
1247619147682504704,FinesseKing_Ish,This coronavirus shit got me scared of eaters,2020-04-07 20:15:59,United States,negative
1247619284936736769,Arvind_k95,"Hey @BhashaM we appreciate ur call for giving up ur crown 👑 ND getting back to work as doctor Amid Covid-19 pandemic.Tiz is wat we call being down to earth #hattsoff to you #missengland 2019,The nation will remember you always for tiz, @narendramodi @PMOIndia  @Kokabalikhan @ANI https://t.co/PuyPn9IlqM",2020-04-07 20:16:31,India,positive
1247619300963356673,andrew_hill_FFT,Social distance in our childcare settings from the @educationgovuk https://t.co/1UPXswh6qG,2020-04-07 20:16:35,United Kingdom,neutral
1247619306189398019,Diamond4812161,Online review. Really pleased my client benefited from the sessions #anxiety #stress #covid19 #coronavirus https://t.co/9BrQGh6nTy,2020-04-07 20:16:36,United Kingdom,positive
1247619322417221633,NinianReid,"TWO-THIRDS of Scots want Brexit to be delayed, according to a new poll. With coronavirus engulfing the political machinery of the UK and the EU, Boris Johnson is coming under increasing pressure…  https://t.co/jfRtOh8tLE",2020-04-07 20:16:40,United Kingdom,neutral
1247619344647049216,de_sportsmom8,"What do you do when you need to do incline. If your a country girl, you make one. I told you no one, not no one is getting up on me. I said I'm coming, doubting me is a mistake. ..
.
..
...
#quarantine #covid19… https://t.co/3bkvmxoiwl",2020-04-07 20:16:46,United States,positive
1247619430865043464,coachswife1998,". @coachmcgee72 it’s #quarantine times and I don’t love you like I used to! 😉😘

🎧 https://t.co/8phrQzPf33 https://t.co/RytTEr0YVP",2020-04-07 20:17:06,United States,negative
1247619457389821953,WHDavid,WHO must answer serious questions before it is trusted with leading a Covid-19 inquiry https://t.co/yiFRnTv8jF,2020-04-07 20:17:12,United Kingdom,negative
1247619506958188544,ic_ivory,"Fake rally. 
Wall Street stretches rally into second day as investors find hopeful coronavirus signs

https://t.co/6XphyMjjjK",2020-04-07 20:17:24,United States,positive
1247619565212913671,yungkamofficial,Quarantine and chill🚫 https://t.co/nKy2OpvP6h,2020-04-07 20:17:38,United States,neutral
1247619579519602689,Oii_MISTA,All the people (not literally but a good majority) making a stink about no where bar right now on fb are the same people I seen snorting lines in their bathroom in the two months before they had to close for coronavirus this is hilarious,2020-04-07 20:17:42,United States,negative
1247619641255415808,BonnieMadden,"@POTUS @VP @senatemajldr @HouseGOP @SenateGOP 
This Covid-19 is a Democrst backed hoax working with China to take us down. Where are all the obituaries of dead in your constituency area? Check it out. It's all abunch of BS. TRUMP IS BEING MADE A FOOL OF!",2020-04-07 20:17:56,United States,negative
1247619641272184832,lilmemo69,Ready to try @Gelish base coat since the quarantine made all the nail ho’s ambitious and depleted the Sally Hansen Uv gel base https://t.co/p2fjiSG9Wc,2020-04-07 20:17:56,United States,neutral
1247619662206164998,ic_ivory,"Florida travelers with coronavirus visited 46 U.S. states, 75 foreign destinations before diagnosis

https://t.co/JDI4B0eQyI",2020-04-07 20:18:01,United States,neutral
1247619666329178113,susieq201688,@NicolleDWallace PLEASE talk about Trump &amp; his CROOKED CRONIES that OWN STOCK in that medicine for CORONAVIRUS! Trump SHOULD TELL AMERICANS THE TRUTH ! No wonder TRUMP is PUSHING the medicine so hard ! This should be against the law !,2020-04-07 20:18:02,United States,negative
1247619674814255105,tedder42,"Quarantine time with neighborcat Simon. @ Portland, Oregon https://t.co/ViY5MkwkHo",2020-04-07 20:18:04,United States,neutral
1247619675854438405,itsmedoublez,quarantine gonna have me purchasing tiny big hats a raccoon on the black market so help me god,2020-04-07 20:18:05,United States,negative
1247619716576874504,RebeccaAnnJean1,The many faces of quarantine boredom https://t.co/9RgfMV6QFs,2020-04-07 20:18:14,United States,negative
1247619716992114691,GeraldHarrisTV,12 News is taking video submissions for the Coronavirus Town Hall with Gov. @tatereeves . Send a video of yourself asking Gov. Reeves your questions to news@wjtv.com. Video must be 20 seconds or less. https://t.co/UUJxslbZ4h https://t.co/V3d9ZFUYYR,2020-04-07 20:18:14,United States,neutral
1247619742246096901,scottkernest,"Navarro memos warning of mass coronavirus death circulated in January

https://t.co/LRmvRbKg8g",2020-04-07 20:18:20,United States,negative
1247619759568453635,RoseKautz,"„Follow the rules of your government. [...] Protecting yourself is protecting your family.“ - Jackie Chan

This message is especially for stubborn Filipinos! #COVID19 #COVID19PH

Jackie Chan COVID-19 Pandemic Message https://t.co/VfFn7sMxX0 via @YouTube",2020-04-07 20:18:24,Germany,positive
1247619763129311232,chimp15,Climate change is real .. I live next a golf course and also about 2 blocks from The 5 freeway. Most of the year all I smell is exhaust. We’ve been in quarantine for 3 plus weeks now and for the first time since moving here in 2012 I can smell the grass being cut ! https://t.co/eeIjninkqf,2020-04-07 20:18:25,United States,positive
1247619770716958725,Diamond4812161,Really lovely that my client applied what she’d learned in the session to help her children #anxiety #online #therapy #WorldHealthDay #COVID19 #coronavirus #stress #family https://t.co/2xgayL6BdP,2020-04-07 20:18:27,United Kingdom,positive
1247619788500865029,Bag_Of_Roks,"Another day of quarantine, another day of @goodmanner_ Coffee! This new blend they got is SO good!

#ShopLocal https://t.co/aeuW8dZyHf",2020-04-07 20:18:31,United States,positive
1247619796604157958,dirtygutters,"The only thing worse than COVID-19 itself is people doing Instagram ‘challenges’ 🤮🤮🤮

 THE WORSSSSSSST.",2020-04-07 20:18:33,United States,negative
1247619833753210890,Matthew77734192,"Its taken a quarantine to be spread to finally accept my hairline is getting bad and now I'm going to shave my head from now on 😂😂
#BaldyFairbanks",2020-04-07 20:18:42,Ireland,negative
1247619834080362496,animaltrainer91,"It's that time of year for that Easter tradition of getting those eggs colored in dye just in time for Sunday's ""Easter in Quarantine"" event. We made the dye with food color, vinegar, and boiling hot water while we… https://t.co/W9eagGukxo",2020-04-07 20:18:42,United States,neutral
1247619850635218944,maleickfleming,"Could you image if we had not seen #AvengersEndgame and then COVID-19 rolls in one month before premiere. 

Would of been sitting in theater with a hazmat suit!",2020-04-07 20:18:46,United States,positive
1247619855525613568,Robbaleestiles1,Saluting the Heroes of the Coronavirus Pandumbic | The Daily Show https://t.co/mlEzKKbS8O via @YouTube,2020-04-07 20:18:47,United States,positive
1247619922563420161,manda8407,"So first it’s coronavirus, then pollen came along, &amp; now it’s raining while the sun is out. What kinda of party is 2020 throwing? #2020isdrunk #ImDone",2020-04-07 20:19:03,United States,negative
1247619931157323781,caityrogo,I feel confident that no matter where this quarantine life takes me I will NOT become invested in the new Bachelor series with musicians. I just won’t.,2020-04-07 20:19:05,United States,negative
1247619948823928833,rnz62,New Frank Ocean to make it through the quarantine ♥️♥️♥️,2020-04-07 20:19:10,United States,positive
1247619960756674567,FoobzEvents,"🔴Whats up Foobz Nation in quarantine.🔴

With this wonderful weather today, we thought we would brighten it up even more with a video of all our best hits during our last events. 

ENJOY AND PLEASE, SHARE IT WITH… https://t.co/YKsEchortn",2020-04-07 20:19:12,Canada,positive
1247619993962975232,LucyB_TX,How to Fight Coronavirus (Without Causing a Global Depression) https://t.co/uMAqY6slRo,2020-04-07 20:19:20,United States,positive
1247620007053463552,ASymonee_,"I’m fw Netflix during this quarantine players club , Cadillac records &amp; soul plane oh yes baby",2020-04-07 20:19:23,United States,neutral
1247620026753896449,ankdedhia,Seems like its gonna be #NoShaveapril this time... #QuarantineDiaries #Quarantine #QuarantineLife #NoShaveQuarantine,2020-04-07 20:19:28,India,neutral
1247620070383087618,kevingance,"Getting ready to record a self tape for my manager, doing a scene from an old NCIS episode as an arsonist being interviewed in prison, stay tuned! 🙏🏼🎥 #actorslife #Quarantine #homestudio",2020-04-07 20:19:39,United States,positive
1247620085994459143,OlogehEmma,"#CoronaVirusUpdate #CoronaVirusInNigeria
Wash your hands frequently with soap under running water. Avoid touching your face &amp; high-contact surfaces to prevent coronavirus spread. Take Responsibility!

#WeWillWin",2020-04-07 20:19:42,Nigeria,positive
1247620110417829889,friends_vanessa,"Is it Friday yet?  Wait...during this quarantine, does it matter? https://t.co/juzkecu5w6",2020-04-07 20:19:48,United States,neutral
1247620133360750592,NecromaniacKat,"Quarantine day 21: Yep, I've officially lost it 😂🤗💯 #quarantine #quarantinelife #yepivelostit #goinginsane #letmedomymakeup #makeup #milkhydrogripprimer #lancometeintidole #maybelline #benefit #benefithulabronzer… https://t.co/F9nrFxW3cf",2020-04-07 20:19:54,Canada,neutral
1247620135717949442,Newspipe_NYC,"Confirmed cases of coronavirus in NYC is up to 76,876 as per the NYS Department of Health — 4,695 new cases. Day-over-day COVID-19 growth rate was 6.5%. These are all positive signals since numbers are holding relatively steady for the most part.

NEW YORK CITY = 76,876 cases https://t.co/aIcrwiPydc",2020-04-07 20:19:54,United States,positive
1247620161605177346,ktb213,"Forbes: COVID-19 Has Decimated Traffic At U.S. Airports [Infographic].
https://t.co/Xl9HiQSDRP

via @GoogleNews",2020-04-07 20:20:00,United States,neutral
1247620166478938112,JaniceKHayes1,@BarackObama ..THAT STANDS FOR TOO...CORONAVIRUS OF THE YEAR 2019 ...BECAUSE THE U.S. GOVERNMENT HAS RELEASED IT UPON THIS EARTH UNDER THE COMMAND OF DONALD J. TRUMP HIMSELF AS AN EXPERIMENT TO SEE WHAT THE REACTION WORLDWIDE UPON EACH CONTINENT AND EACH COUNTRY ALSO...AN OT OF..,2020-04-07 20:20:02,United States,negative
1247620204412260352,sfgbabe,Just like in normal life I don’t care what 98% of people are doing 🤷🏻‍♀️ mind your own quarantine 👋🏽🤪💕,2020-04-07 20:20:11,United States,positive
1247620207113375746,OnaagoshinAnang,"If you haven’t quite grasped the  racialized perspective. This is why we are discussing privilege and power dynamics. This is why we’re scared #COVID19

https://t.co/kberOtQQFJ",2020-04-07 20:20:11,Canada,neutral
1247620224582483968,jennacryan,Made myself dizzy walking in circles around the house #quarantine,2020-04-07 20:20:15,United States,negative
1247620228659515393,chrisphin,"Catching up with the coronavirus WFH special of @haveigotnews. Torn between admiration for the producers, talent and editors, and existential terror that this is our reality.",2020-04-07 20:20:16,United Kingdom,negative
1247620246078230530,mitch2o9,"quarantine got my family finally happy and getting along lol , i’m amazed",2020-04-07 20:20:20,United States,positive
1247620262721458177,JavierRosales6,"COVID 19 Workout #7 
19 minute AMRAP (as many rounds as possible)
15 thrusters
15 crunches
15 leg raises
15 rows
Rest 30 sec
#COVID19WORKOUT #homeworkouts #coronavirus #noexcuses #COVID19 
https://t.co/O7eg5uhULO via @YouTube",2020-04-07 20:20:24,United States,neutral
1247620278466813953,christoph7809,"Quarantine life:  About to get in the shower, call from a client and sitting butt naked looking at a spreadsheet.  Any money is money.",2020-04-07 20:20:28,United States,neutral
1247620307936063493,Ot__Happy,So I stepped out of my house cause I can’t be indoors anymore and my neighbor saw me and she says “Damn quarantine ain’t doing you justice you look like scar from lion king” LET ME LIVE KAREN https://t.co/8jSc8eB0nW,2020-04-07 20:20:35,United States,negative
1247620328970506240,Emma_Campaigner,"All of us are different, but I know I'd rather be told ""lockdown til June"" (for example than waiting week by week. https://t.co/7dbkz0xHYC",2020-04-07 20:20:40,United Kingdom,positive
1247620337195347968,rrrakesh817,One good things we have in COVID-19 time that now we have one story to tell your GRAND CHILD or GRAND FATHER 😂,2020-04-07 20:20:42,India,positive
1247620341440053248,DatJrzyChic,Acting Navy secretary resigns over controversial remarks about ousted coronavirus whistleblower  https://t.co/GYOXnKro7A,2020-04-07 20:20:43,United States,negative
1247620342807277569,_megannn_m,okay serious question do I dye my hair brunette after quarantine,2020-04-07 20:20:44,United States,neutral
1247620346091646977,FrankieTrynoski,I’m pretending that Miranda discovering Tik Tok isn’t the most entertaining thing to come out of this quarantine.,2020-04-07 20:20:44,United States,negative
1247620362717876224,blancatovar__,"For the first time ever, throughout this whole quarantine, I grabbed sliced apples, over a bag of chips 😭 I’m so proud lmao",2020-04-07 20:20:48,United States,positive
1247620367763423233,ShellyeKOAT,#UPDATE: Good news to report. At least 133 recovered COVID-19 cases in New Mexico https://t.co/jXcImwNPab,2020-04-07 20:20:49,United States,positive
1247620404182691845,zoderose,I officially know someone who had died of COVID-19,2020-04-07 20:20:58,United States,negative
1247620446062772227,hannahalbor,"@GregAbbott_TX should be focused on responding to the covid-19 crisis, not exploiting it to strip texans of their right to choose. abortion IS essential healthcare. i call on you to state that @KenPaxtonTX's threat to fine and jail abortion providers is wrong! #OurBodiesOurPower",2020-04-07 20:21:08,United States,negative
1247620472042401793,tjlinehan,"Thousands of coronavirus-infected New Yorkers treated with anti-malarial drug

https://t.co/oj5IX35mWs",2020-04-07 20:21:14,United States,neutral
1247620500936949761,AnastaciaTucker,@TownofWNY What do you do if your super/landlord shut your water off in the entire apartment building in the middle of the pandemic &amp; didn't notify any of the tenants??? #MayorGabrielRodriguez #COVID19 #coronavirus,2020-04-07 20:21:21,United States,neutral
1247620522244026368,dwilliamsartist,"God, I seriously HOPE not!! 🙏🏻 
UK will have Europe's worst coronavirus death toll, study predicts https://t.co/WejnKrpnA9",2020-04-07 20:21:26,Spain,negative
1247620526673199106,MikeLaCrosseWBZ,Tonight at 5 ... a Salem man is sharing memories of his late wife Vitalina. The Market Basket employee died of coronavirus this weekend @wbz #wbz https://t.co/i91O7xOFiP,2020-04-07 20:21:27,United States,negative
1247620530095525888,bluthecolor,Quarantine vibes (retweet tf outta this)  #music #newartist #newyork #vibes #newmusic #like #follow https://t.co/k38SGajHfT,2020-04-07 20:21:28,United States,neutral
1247620605123465224,BornAngelAuthor,"I’m admitting it. I’m depressed. That or hormonal. My Dog dying and Covid-19 making me unable to see my grandparents (who I used to see twice a week at church), plus Easter dinner night longer happening and some private issues not working out this year... It’s breaking my heart. https://t.co/BMleEC26E0",2020-04-07 20:21:46,United States,negative
1247620622731161604,iam_kingbee,So either this guy got covid-19 in Hwange or he spread it there?,2020-04-07 20:21:50,Zimbabwe,negative
1247620640821182465,manyplums,"Collaborating already? Thinking about collaborating? I heartily recommend it! When we write together, we remember we are not alone. 

Brenda Miller &amp; I wrote about collaborating in the time of Covid-19 @brevitymag this week. Here’s our how &amp; why: ❤️📚❤️

https://t.co/YQxqcqpyOJ",2020-04-07 20:21:55,United States,neutral
1247620643602026496,iquitsmoking1ja,Ironic that the Wisconsin Supreme Court met virtually today—because of COVID-19 risk   But citizens of Wisconsin should be put at risk to vote in person right ahead of our pandemic surge.   The @TheOnion  Nailed it https://t.co/8opO4pz9Qd,2020-04-07 20:21:55,United States,negative
1247620649201344514,JJordvn,Watching quarantine radio. DND.  Please and thank you,2020-04-07 20:21:57,United States,neutral
1247620652393279488,ToineThisToine,I wish I could throw ass on Quarantine Radio.,2020-04-07 20:21:57,United States,negative
1247620661155188736,under_palms,Quarantine has me replying this to every snap https://t.co/4wHSBfO9db,2020-04-07 20:21:59,United States,neutral
1247620706763821056,FranckieDollars,"Calling 2019 back. 2020, has no manners. 🌎 🙏🏽 🌍 
.
.
.
#newworldorder #lockdown #bored #strategy #oldmoney #coronavirus #5g #itiswhatitis #globalplayer #stayhome #staysafe #francispoku #dreamclub #dollaranddream @… https://t.co/3PFmvbtnlg",2020-04-07 20:22:10,Ghana,negative
1247620732273610752,bluebloodmusic_,Since Quarantine started I’ve been focusing on a different genre each week just to learn new things and styles and I’m having fun on day 2 of dnb https://t.co/GKiG4eqPcs,2020-04-07 20:22:16,United States,positive
1247620735838892034,OnStuk,My Quarantine savings though,2020-04-07 20:22:17,United States,positive
1247620736799461376,anjan_dhar6,This is our IBD Specialist Nurse donned up on the COVID-19 Ward in full PPE during one of her shifts. These fantastic nurses are doing their bit on the frontline in addition to their specialist role. Our NHS Heroes. @CDDFTNHS @BritSocGastro https://t.co/J1w7jbiFY6,2020-04-07 20:22:17,United Kingdom,positive
1247620740561723394,Ally_love03,Idk how many times I’ve made pizza since quarantine lol 😂😂😂😂💀💀💀,2020-04-07 20:22:18,United States,neutral
1247620782513143808,afr0hippie,This quarantine doing my creativity sum good. Beat by @mynameistairiq https://t.co/25uuhEziga,2020-04-07 20:22:28,United States,positive
1247620790813483008,arunverma1080,"How long is the incubation period for COVID-19?

The “incubation period” means the time between catching the virus and beginning to have symptoms of the disease. Most estimates of the incubation period for COVID-19 range from 1-14 days, most commonly around five days.",2020-04-07 20:22:30,India,neutral
1247620790759108613,mosesdas,"The “Business Casual” look of quarantine fashion. DM me for more tips and tricks to show up to your next Zoom party looking like an online fashion mogul. 🕺🏽👘😎
.
Robe de Chambre by dior 
Spekkie Glecks: lenoxsqmall… https://t.co/yMac1XvQQZ",2020-04-07 20:22:30,United States,neutral
1247620810820509699,DRWAGNERGARCIA,51 recovered coronavirus patients in South Korea test positive again after release from quarantine https://t.co/rbeVOL81um #FoxNews,2020-04-07 20:22:35,Canada,negative
1247620833369100289,murrrrum,"Day ???? Of quarantine: jumped because I saw another human in my room. It was me. It was my reflection in the mirror.

Not sure if I’m startled by other humans at this point, or if I’ve let myself go that much.",2020-04-07 20:22:41,United States,negative
1247620908237324290,JoelRMelamedMD,Retired #NYPD sergeant with coronavirus drops dead on #ParkAvenue at 77th Street after leaving ⁦@lenoxhill⁩ 😳😔‼️ https://t.co/MuubxAuZU2,2020-04-07 20:22:58,United States,negative
1247621088097566722,kmvskeeling,"Eat, sleep, quarantine &amp; repeat https://t.co/dNOtqhqnIx",2020-04-07 20:23:41,United States,neutral
1247621117155643394,mikechislehurst,Interesting 2 see how different countries are dealing with the Coronavirus. #StayAtHome #StayHomeSaveLives 🇳🇿 https://t.co/sV5ziGA2Tl,2020-04-07 20:23:48,United Kingdom,neutral
1247621154593964032,atcpilot787,".. practice every morning .. 
#quarantine #mma #practice #workout #kickboxing #martialarts #wod #training #athlete #performance #trainhard #reeboktraining #crossfit #fitness #tuesday #tacotuesday #stayhome https://t.co/8DX9bWKySH",2020-04-07 20:23:57,United States,positive
1247621176438018049,ash_5soslover94,"quarantine has constisted of so far: 

•complaining about wanting a bf 
•annoying the fuck out of halley everyday 
•dance gavin dance 
•eating 
•procrasinating on my homework 
•being ugly 
•turning 18 finally",2020-04-07 20:24:02,United States,negative
1247621180451778560,HainesForSF,San Francisco :: San Francisco :: The timeline of Trump’s coronavirus response is increasingly damning https://t.co/Vi8RxC7Mar Text Squad to 66599 Text Squad to 66599,2020-04-07 20:24:03,United States,neutral
1247621188873940992,HainesForSF,San Francisco :: San Francisco :: Top Navy official resigns after insulting warship captain who expressed alarm about service’s handling of covid-19 outbreak on ship https://t.co/pvzRdgHcBM Text Squad to 66599 Text Squad to 66599,2020-04-07 20:24:05,United States,negative
1247621221887488004,RandyLudlow,"Ohio tax revenue takes hit as coronavirus orders close businesses
https://t.co/lKmYEZodjX",2020-04-07 20:24:13,United States,negative
1247621222583631874,macylynnXX,I just slept until 4:15 pm. THIS QUARANTINE NEEDS TO BE OVER.,2020-04-07 20:24:13,United States,negative
1247621257656446976,ElectWells,Thank you @Nick_Mosby and others for making sure we have access to data that will help us develop an effective and equitable strategies for directing resources to address  phttps://www.baltimoresun.com/coronavirus/bs-md-hogan-tuesday-20200407-jmvtijbmmrb5fmctde4poqta4i-story.html,2020-04-07 20:24:22,United States,positive
1247621272663740416,anita_ckn,I really enjoy T9et Lanes Quarantine Radio live in IG but the data shuu,2020-04-07 20:24:25,South Africa,positive
1247621272785346563,RoseRoyceBoyz,Quarantine day 5...I really love this bitch https://t.co/I9DHdNxSEQ,2020-04-07 20:24:25,United States,positive
1247621286185951232,EdiMoraMusic,"Working out outside is becoming my favorite part of the quarantine 💪🙌
Should have recorded the first set not the last one 🤦‍♂️😂 @ Richmond, Virginia https://t.co/z5Kzqj4sGA",2020-04-07 20:24:28,United States,positive
1247621324089909249,ahamazahir,SELF-DELUSIONAL America can only beat Covid-19 if it stops blaming China and faces up to its own pandemic mistakes — RT Op-ed https://t.co/gtzOeuhEZq,2020-04-07 20:24:38,Maldives,negative
1247621327994920962,ViktoBeats,"Everyday feels like a long Sunday #quarantine #covid19 #boredom @ Mission Hills, California https://t.co/LNYhfhCdi9",2020-04-07 20:24:38,United States,neutral
1247621344788910081,sensomnoire,Quarantine radio is back!!,2020-04-07 20:24:42,United States,positive
1247621356642074625,cindyzimmer,Depressed ! Slept the afternoon away. #WorldHealthDay #coronavirus #tired,2020-04-07 20:24:45,Canada,negative
1247621382080548865,GenoEu,"Susan Rice extended her support to ""PBS NewsHour"" White House correspondent Yamiche Alcindor after her exchange with President Trump: ""Pathetic when insecure men can’t stomach strong black women."" https://t.co/hfXAn02xla via @HuffPostPol",2020-04-07 20:24:51,United States,negative
1247621427962023936,valeniricibar,"Incredibly grateful for my neighbourhood mutual aid in Ridgewood 💚 #MutualAid #Queens #coronavirus  ➡️☎️ Text ""I need support"" to (929) 251 - 5044 @RidgewdTenantsU https://t.co/yxg5wdIO68",2020-04-07 20:25:02,United States,positive
1247621445745770500,Premier_3k,Aye this quarantine forced drought is really trying my sanity.,2020-04-07 20:25:07,United States,negative
1247621465890906112,jnackstrand,"One more day of the COVID-19 #coronavirus in Stockholm. More than 100 people died in the last 24 hours! #stayhome #covid19 #nikon #nikonphotography #health #world @afpphoto @ Stockholm, Sweden https://t.co/jmM9BKKfja",2020-04-07 20:25:11,Sweden,negative
1247621467094876161,princesleah_a,"This quarantine has driven my mom to games on her phone. Completely normal. However, she just said “I’m really tempted to just pay the $2.99 so that I don’t get ads.”",2020-04-07 20:25:12,United States,negative
1247621491732209664,PrimeMePretty_,"15 minutes makeover for a damsel.. that's how roll.. 
.
.
#coronavirus gat nothing on us.. 
We work
We pray
We love 
We praise
We do what we need to do
We stay healthy
We stay safe
#stayhome… https://t.co/t8z3A6RrJ7",2020-04-07 20:25:17,Nigeria,positive
1247621511869014016,kapplegate6,My credit card limit increased so I spent more cash and got stuff for my nails and some masks and I’m... excited?? It’s been a long 4 years in this quarantine,2020-04-07 20:25:22,United States,neutral
1247621534195294208,adex0057,"Fidelis Castro would be a pleased man in his grave. He left Cuba with strong health section and sound education system. Even western world can not look away from his unprecedented achievements. 

Cuba doctors are helping America, Europe and Africa to fight COVID-19",2020-04-07 20:25:28,Nigeria,positive
