tweet_id,user,text,created at,location,sentiment
1247616207320162304,dgtlchrch,SCRIPTURE MAKES SENSE NOW - This is the second clip from episode 1 of a conversation between @darrenr &amp; Francis Chan regarding our current crisis of the coronavirus. Watch the full clip on our IGTV! https://t.co/mrrOVfpNEZ,2020-04-07 20:04:18,,neutral
1247616208012218375,DanWuori,"""The financial realities for #childcare businesses and non-profits are stark, even for those open serving children of essential workers. Bills for food suppliers, insurance, landlords and most importantly, the wages of working staff do not stop."" https://t.co/J8mlEqi54Y",2020-04-07 20:04:18,,neutral
1247616208104558592,chaunceydevega,"Mind control expert Steven Hassan explains the power of Donald Trump's #coronavirus death cult and why his supporters are willing to sacrifice their lives for him. My new @Salon

https://t.co/Cjj2VyQZ3S",2020-04-07 20:04:18,,negative
1247616208838578176,ZaynabKAhmed,"I miss the feminist makeup group chat, I wonder how they’re all doing in this quarantine 😔",2020-04-07 20:04:18,,neutral
1247616208742092807,minsterfm,NATIONAL NEWS: Coronavirus: What do the figures tell us about Boris Johnson's chances of a full recovery? https://t.co/RJtS331CaE,2020-04-07 20:04:18,,neutral
1247616203830542337,jayindigostar14,Norway announces it has 'brought coronavirus under control' https://t.co/7DyF0tVXBI via @MailOnline,2020-04-07 20:04:17,,positive
1247616204749058053,qwerty14117587,"Trump replaces Pentagon IG, removing him from coronavirus relief oversight panel https://t.co/S5Gxi2yPuE",2020-04-07 20:04:17,,neutral
1247616209102782465,andreap19ap,Coronavirus Everyone has a right to live. What about those. incarceration.,2020-04-07 20:04:18,United States,negative
1247616209673166848,harryalba,I can only imagine how much a vaccine would cost if this person has anything to do with it...Martin Shkreli Pleads for 3-Month Prison Furlough to Help COVID-19 R&amp;D Efforts https://t.co/U4iMPwOJqR #COVID19 #coronavirus,2020-04-07 20:04:18,,neutral
1247616210432176128,bryanlanning,We tell you how to safely vacation during quarantine! 👏😂 https://t.co/ih4GP9hiQ8,2020-04-07 20:04:18,,positive
1247616210465742848,feline_cannon,"55% of COVID deaths in NY are associated with hypertension and 37% are associated with diabetes. Both diseases correlate with over-expression of the coronavirus’s target protein ACE2 (indirectly through medication with former).

https://t.co/l1cVp9B2tp

https://t.co/mCzyoM3c8w",2020-04-07 20:04:18,,neutral
1247616210730188801,HInnov8,"Top story: Trump removes independent watchdog tasked with overseeing coronavirus emergency funds  - CNNPolitics https://t.co/cAJNYiUZZw, see more https://t.co/LIgeVMr7aW",2020-04-07 20:04:18,,neutral
1247616214290984960,bonniebear09,This quarantine made me realize I could NEVER go to jail. I wasn’t made for this life I need to be free like a mf butterfly or whateva,2020-04-07 20:04:19,,neutral
1247616213544505344,VotingMomIL,"To all the healthcare workers on the front lines of the Covid-19 crisis (including my favorite #GVP champ pictured here) working day and night to protect public health &amp; safety, this Illinois
@MomsDemand volunteer says THANK YOU! @Everytown #NPHW https://t.co/9qA6Fj1WVx",2020-04-07 20:04:19,,positive
1247616214697984010,MeisterG_,How can Mufti wanna go live when same time as Quarantine Radio 😭😂,2020-04-07 20:04:19,,neutral
1247616214853193729,najeebarqureshi,"A #zoo has been #trying to get two #Pandas to #Mate for 10 #years. When #coronavirus shut the #zoo down, the #Pandas #finally did https://t.co/0c0OlBLCSW via @CNNTravel",2020-04-07 20:04:19,,neutral
1247616214769086465,jack,"I’m moving $1B of my Square equity (~28% of my wealth) to #startsmall LLC to fund global COVID-19 relief. After we disarm this pandemic, the focus will shift to girl’s health and education, and UBI. It will operate transparently, all flows tracked here: https://t.co/hVkUczDQmz",2020-04-07 20:04:19,,positive
1247616214945284098,mike_f_hancock,COVID-19 has brought up a lot of questions from new and current clients; how do you meet with clients? how will this affect my case? How do I get medical treatment? At Hancock Injury Attorney our mission is still to… https://t.co/ClyHHOIIx6,2020-04-07 20:04:19,,neutral
1247616218376417280,comradeporkchop,really regretting not dating before quarantine and having another person with us smh,2020-04-07 20:04:20,,negative
1247616218548310017,cwuEastern__No5,Warrington Royal Mail staff walk out as worker tests positive for coronavirus | Warrington Guardian https://t.co/9Pyl8xsH1O,2020-04-07 20:04:20,,negative
1247616218472673280,dj7u,"@realDonaldTrump @GavinNewsom 

Experts say keep high risk at home &amp; release them as they get antibodies: 

https://t.co/a8fWSdqFZN

@DrOz @drdrew @JoeNBC @morningmika @TuckerCarlson @seanhannity @IngrahamAngle",2020-04-07 20:04:20,,negative
1247616218917453825,ActingTheGom,I've lost 1kg in the last 40days but developed a little #Quarantine belly.,2020-04-07 20:04:20,,neutral
1247616217189400578,SexWithEmily,"NEW PODCAST –

A lot (&amp; I mean…a lot) of you have been asking me about dating in the time of Coronavirus. It's actually a great opportunity to get to know people before getting physical.

@AmyNobile is going to help you get there 😉

Full episode here: https://t.co/yuODZoOxdP 💋 https://t.co/MTKteVkBvh",2020-04-07 20:04:20,,neutral
1247616219294961667,RWDSU,"“Our union members are heros. They are feeding America during the COVID-19 pandemic, and they need to be protected.""

Poultry plant workers are being forced into close proximity w/o sufficient protective equipment. Read more on our site: https://t.co/yTry2XCOJl @sappelbaum @ufcw",2020-04-07 20:04:20,,negative
1247616219605274625,makarellablog,"GistTube9ja: USA records 1,150 COVID-19 deaths in 24 hours – Jo... https://t.co/elvbYJnl2u",2020-04-07 20:04:20,,negative
1247616219685040129,latenighton,Is anyone else super tired during quarantine or is this just my lack of seratonin speaking - I’m even going on like a 40 minute walk everyday but still super tired by like 8pm  and I’m sleeping a lot,2020-04-07 20:04:21,,neutral
1247616219588460547,icjtv24,"No new case of coronavirus COVID-19 case found in Sector 8 of Noida, says District Magistrate | Uttar Pradesh News https://t.co/iau5N3b2G9 https://t.co/jbtTDbxMmY",2020-04-07 20:04:20,,neutral
1247616222625173504,chocmilkhoney,LOOOOOOL Tory has bottle girls on quarantine radio,2020-04-07 20:04:21,,neutral
1247616222843330566,MocoKosso,@torylanez got bottle girls now on Quarantine radio 🔥🔥😂,2020-04-07 20:04:21,,neutral
1247616222688096261,DegreesofHealth,"Psychology professor Sayward Harrison offers advice for building resiliency in the time of the coronavirus pandemic. ""...we can have a unique opportunity to chart new courses as individuals and as a whole."" https://t.co/x7YxpNfSTe https://t.co/3QVzUCx0vO",2020-04-07 20:04:21,,positive
1247616226425278466,TheAlyxChicago,"I just deleted all tweets &gt;1 month old, for our world now is different than it was then.

And when we are out of quarantine, I will delete *these* tweets and start fresh yet again.

We are living chapter by chapter, day by day, &amp; I feel that this makes sense. ♡ https://t.co/tHChm5Es62",2020-04-07 20:04:22,,neutral
1247616226756628485,gergerlioglueng,"1) A saddening news!
There are plenty of people out there whose lives have been ruined.
I hope the parliament will not stay silent to this. 
“Ozgur Dogan, married and a father of 3 children,++

Eşitİnfaz Yaşatır

#DontTurnPrisonsIntoGraveyard
#CoronaVirus #CoronaPandemic #COVID19 https://t.co/elJ58GNuVP",2020-04-07 20:04:22,,negative
1247616227087876104,EdwardsOhio,"Keep it up, Ohio. It does appear that we’re flattening the curve. https://t.co/gdCOzimCOL https://t.co/g7CWNvwMLT",2020-04-07 20:04:22,,positive
1247616227201159168,Sarah3Martin,I’ve been sharing virtual videos like this while in quarantine with students. #iowamath https://t.co/r3e3iIKeTk,2020-04-07 20:04:22,,neutral
1247616228673257472,markhyena,COVID-19 https://t.co/2g41l6vsrU,2020-04-07 20:04:23,,neutral
1247616230242074624,Kingme212,Here is my 2 of like 3 pics that I'll probably post of myself this year. Lol. Don't do it often. Thank the quarantine... https://t.co/uCT2Fy7zix,2020-04-07 20:04:23,,neutral
1247616231105953793,Berniewouldawon,Is China releasing accurate coronavirus numbers?,2020-04-07 20:04:23,,neutral
1247616231487803393,BOAW_shotsfired,"People won’t start taking COVID-19 seriously until someone they know has it. Sad, but true. Smh.",2020-04-07 20:04:23,,negative
1247616231617843205,brooks9675309,"So if you die for any reason, was Coronavirus the cause of death?
Are tests done to confirm?

Or, is there $ attached to this pandemic that appears in proportion to the # of coronavirus deaths?",2020-04-07 20:04:23,,negative
1247616231995310086,lucietellier175,"Top story: Senior heart surgeon at Cardiff hospital dies from coronavirus | World news | The Guardian https://t.co/6t2KYMUIRC, see more https://t.co/aQbkJdLFh7",2020-04-07 20:04:23,,negative
1247616232158871555,cmcuffman,More Americans have now died of COVID-19 than died in the 2009 H1N1 Swine Flu Pandemic.,2020-04-07 20:04:23,,negative
1247616232167219201,D_Faria,"Study: UK will have highest coronavirus death toll in Europe

https://t.co/Fi0gVfI5u6

Sent via @updayUK",2020-04-07 20:04:23,,negative
1247616232439848963,SingleMAhoy,Entire evening spent writing clues for a birthday treasure hunt. S is always asking me to do a treasure hunt &amp; I never have time... On Thursday she's getting the mother of all treasure hunts. In your face covid-19 - you can't spoil S's birthday fun!,2020-04-07 20:04:24,United Kingdom,positive
1247616232540561409,ianmbunde,Quarantine radio is already on 120k viewers,2020-04-07 20:04:24,,neutral
1247616232603385865,_unvRICH,due to this Rona i’ve decided that from now own i’m about to pop out real fine everywhere i go..this whole quarantine shit made me realize i can’t be taking the opportunity to be cute for granted anymore 😭 i’m about to become the overdressed friend lol,2020-04-07 20:04:24,,negative
1247616235036016640,StuNewsLaguna,Council to discuss financial impact of COVID-19 and possible solutions. https://t.co/ExQ9TgHHTT,2020-04-07 20:04:24,United States,neutral
1247616235757547521,sammmyak7,Tory went from like 2m followers to 7m since he started quarantine radio 😭,2020-04-07 20:04:24,,neutral
1247616236399276034,Brenda78052965,"Rand Paul recovers from coronavirus, tests negative

https://t.co/Optlze4b6b",2020-04-07 20:04:25,,positive
1247616236575391749,medicalbook1,Where to Find Free Entertainment During the Coronavirus Shutdown https://t.co/ihNxKwLlqA,2020-04-07 20:04:25,,neutral
1247616237292716035,aldoceccarelli,⁦@RiccardoLuna 👏⁩ #WhatsApp is limiting message forwarding to combat #coronavirus #misinformation https://t.co/2qEgaUbG1C #fakenews #taskforce,2020-04-07 20:04:25,,positive
1247616237095587840,gobradiouk,Coronavirus UK: Chris Whitty admits mass testing came too late https://t.co/gnRJwIMsQr https://t.co/pfFC6zTPJM,2020-04-07 20:04:25,,negative
1247616239280828418,Kristin_Byrne,"Allstate, American Family Insurance, Liberty Mutual to return millions in auto premiums as drivers hit the road less during coronavirus https://t.co/QXzhNDqUHT",2020-04-07 20:04:25,,positive
1247616239708581893,lexloafin,Going to pause snowfall for quarantine radio,2020-04-07 20:04:25,,neutral
1247616239691862023,Chijjim,Quarantine day 13.. a break from the monotony..... an asthma attack.. cool.,2020-04-07 20:04:25,,neutral
1247616239846985729,strangersniall,@juliamichaels @jpsaxe #itwwejpandjulia first thing you’ll do after quarantine is over?,2020-04-07 20:04:25,,neutral
1247616240132272130,billboard,".@JLo chatted how quarantine is affecting her wedding plans, her new show #ThanksAMillion &amp; more https://t.co/3mMiY5emns",2020-04-07 20:04:25,,neutral
1247616240086106112,acerbo_livio,Why Does Covid-19 Make Some People So Sick? Ask Their DNA https://t.co/iEeDe8HoFS,2020-04-07 20:04:25,,neutral
1247616240375521287,landryst,"#HigherEd Presidents Expect Layoffs, Admissions Trouble - @madelinestamour

https://t.co/7lVJHMUrN4 #economy #coronavirus #COVID19

""About 70 pct of presidents expect to see revenue decline by at least 10 pct, with presidents of small institutions expecting a larger hit.""",2020-04-07 20:04:25,,negative
1247616240585236481,OpusOfHussain,"Ireland's Prime Minister

""I am a doctor, i will offer my services once a Week to Medical facilities to fight Corona""

India's Prime Minister

"" I am a Chaiwala, my core-competency is making tea. I will put up a Chai stall outside Hospital once a week""
#COVID19 #coronavirus",2020-04-07 20:04:26,,neutral
1247616243605082113,BoingBoing,Wyoming the last U.S. state with no Covid-19 deaths yet reported https://t.co/w1Kbm9mwvU,2020-04-07 20:04:26,,positive
1247616243630321666,Charlie55498611,"Key Trump coronavirus task force must work remotely after positive COVID-19 test
 https://t.co/Jdz6bBHzCj",2020-04-07 20:04:26,,neutral
1247616244003594241,pash22,The horror of #coronavirus is all too real: Don't turn it into an imaginary war via @MarinaHyde https://t.co/PdNvnKSyfc,2020-04-07 20:04:26,,negative
1247616244276023297,TVPartyPlanner,Have discovered I'm in quarantine with a mosquito family.,2020-04-07 20:04:26,,neutral
1247616243584004097,hakimi_jabar,WHY MUST COVID-19 PUT BORIS JOHNSON IN ICU?  WHY NOT TAKE MALAYSIAN POLITICIANS &amp; THEIR KIND? https://t.co/EzqfNf5bhn,2020-04-07 20:04:26,,neutral
1247616244569817089,IsntThatBAWSE,Day 69919181610 of quarantine : Whew I’ve had a long morning of tweeting. Time for a nap. Lmao,2020-04-07 20:04:26,,neutral
1247616244695494657,margauxmonet,7 Productive Ways to Spend All the Downtime You May Have Right Now https://t.co/QGpJxPzBeQ #MARGAUXMONET,2020-04-07 20:04:26,,positive
1247616244796227587,Wellcome_Home,(Trump removes inspector general poised to oversee coronavirus stimulus funds) has been published on Good News - https://t.co/RKynubL57c,2020-04-07 20:04:27,,negative
1247616245211463681,FearNoArt,"What does fascism look like?

@realDonaldTrump removed inspector general set to probe corruption and provide oversight of the government’s response to the economic downturn caused by coronavirus pandemic, the last sign of his disdain for any oversight of his administration",2020-04-07 20:04:27,United States,negative
1247616245504962560,echarisscott,"Is anyone else super annoyed with how much media is fixating on ""why Bernie should drop out"" and ""this is Bernie's last chance""? He literally isn't taking donations for himself anymore, and he's directing all of his attention towards covid-19 relief.",2020-04-07 20:04:27,,neutral
1247616247778467841,ptaoliving,Why is quarantine radio so early today?,2020-04-07 20:04:27,,neutral
1247616248499838978,Vahal,"Survival of the fittest???
Coronavirus: The European countries beginning to lift lockdown measures https://t.co/rSDeOYi0BQ",2020-04-07 20:04:27,,neutral
1247616248701243394,sarahhdayy,should i cut my hair during quarantine,2020-04-07 20:04:27,United States,neutral
1247616248667570176,MarkSKrikorian,"Undocumented workers among those hit first — and worst — by the coronavirus shutdown https://t.co/J5xvJ0A07Q World to End; Women, Minorities Hardest Hit.",2020-04-07 20:04:27,,negative
1247616248764080130,doyinrose_,Quarantine radio is now my motive for this evening,2020-04-07 20:04:27,,positive
1247616248617340929,HabitekUK,"Top story: Coronavirus updates: UK PM Johnson being treated by 'finest doctors' - BBC News https://t.co/t4gUBLn4RH, see more https://t.co/xPZyGeBiDw",2020-04-07 20:04:27,,neutral
1247616247233155073,alittletravel_,"When I was recovering with coronavirus/COVID-19 I ate sopa de ajo, a garlic soup dish from northwest Spain, nearly every day Here is how to make it in your home. https://t.co/CgnFhi0g11 #healthandwellness https://t.co/qjktFLRPk9",2020-04-07 20:04:27,,neutral
1247616249137434625,MethanolBastard,"Fucking hell the narrator of the Coronavirus public info films and adverts is annoying. Perhaps using someone with a more interesting voice might engage people a little more? Is Brian Blessed free?

#COVID19 #coronavirusuk",2020-04-07 20:04:28,,neutral
1247616249351344135,IKEMERCY8,😂😂😂 this Quarantine  made me realise how much I love Tory Lanez,2020-04-07 20:04:28,,neutral
1247616249342889984,modrnhealthcr,#LIVE: #Northwell Health shares support #video for #healthcare workers | #Beaumont Health implements process to disinfect used #N95 masks  and other #updates on #COVID19. #coronavirus https://t.co/fZKWuGVJPj,2020-04-07 20:04:28,,positive
1247616251846852609,LighthouseForum,"Alberta Has 98 New COVID-19 Cases, Bringing Total To 1,348 - The Lighthouse Christian Forum https://t.co/mQkqTPKscr",2020-04-07 20:04:28,,negative
1247616252320911360,cass__maria,quarantine has me bored so i’m going to try to get famous people i like to follow me Day 17 @rexorangecounty @KingPrincess69 @Harry_Styles @Zendaya @waterskigrl @clairo,2020-04-07 20:04:28,,neutral
1247616252274774017,AnthonyEhrhardt,"Top story: U.S. reports 1,200 coronavirus deaths in one day as China lifts lockdown https://t.co/9ZRgwx9Q8P, see more https://t.co/quwIduLVcM",2020-04-07 20:04:28,,negative
1247616252404731907,Armanskii,"Dear quarantine diary,                           It’s day 93 of lockdown and people are having philosophical debates on what the meaning behind drakes toosie slide dance really means. I’m sadly intrigued.",2020-04-07 20:04:28,,neutral
1247616252794806272,Jagsfan1876otig,"Israel health minister, who claims coronavirus is ‘divine punishment’ for homosexuality, tests positive for COVID-19 
Health minister tests positive for Covid-19 after ignoring own lockdown rules https://t.co/vfzR6TjOrK",2020-04-07 20:04:28,,neutral
1247616253709213697,LeftyNorman,Mortgage lenders are tightening standards as coronavirus crisis worsens https://t.co/cfVw0b3cOD,2020-04-07 20:04:29,,neutral
1247616253709221895,GrowtrustPartn1,"As we wait for new COVID-19 cases to peak in the United States, we look at recent bear market bounces and high unemployment claims. But there is some good news. Find out more in this week's episode of LPL Market Signals. https://t.co/rsWfNoZ5cJ",2020-04-07 20:04:29,,neutral
1247616256066322434,EarlVaughanJr,Acting Navy boss submits resignation amid coronavirus uproar (from @AP) https://t.co/l1Wr5ZDGFt,2020-04-07 20:04:29,,neutral
1247616255948922882,wvjoe911,How the Coronavirus Bailout Repeats 2008’s Mistakes: Huge Corporate Payoffs With Little Accountability https://t.co/Nd9u0rFdHk,2020-04-07 20:04:29,,neutral
1247616256217419781,dietvanillacola,everyone here saying they want to surprise friends by being skinny after quarantine hun who said we’re even leaving this year,2020-04-07 20:04:29,,neutral
1247616256045248512,EditedbyJamie,"https://t.co/Nuw3BEJxpg
The CDC has asked Americans to make cloth face coverings in an effort to keep masks available for health care workers.",2020-04-07 20:04:29,,neutral
1247616256372551680,darthguccci,my crush put Justin Bieber on his quarantine playlist he really is a king,2020-04-07 20:04:29,United States,neutral
1247616256645177344,6xkaos,"And that’s why their ratings SUCK!!

American Media Still Using China's Bogus Numbers on New Wuhan Coronavirus Cases https://t.co/gXWX3JeqFQ",2020-04-07 20:04:29,,negative
1247616256573833219,infiniteaparty,"“Trump’s bump was one of the smallest — and is already starting to fade.”

Are they talking about your tiny mushroom bump, @realDonaldTrump?

“The smallest”

Ha ha ha ha ha ha ha ha ha. 

https://t.co/bEPDK6z9BJ",2020-04-07 20:04:29,,neutral
1247616256963784704,colaMYsoda,"quarantine is that season, where mfers will miss you for no reason. (citygirls voice)",2020-04-07 20:04:29,,neutral
1247616257156886528,Livid2point0,"Coronavirus: NHS staff with Covid-19 given wrong test results
https://t.co/wa7cy1gW9t",2020-04-07 20:04:29,,negative
1247616257245024258,AnwarKh22621067,"Be Careful in your daily life routine..
Coronavirus is a serious issue https://t.co/AySgrjVIRx",2020-04-07 20:04:29,,neutral
1247616257744134145,lovelin_paul,Taking care of your precious pearls during Covid-19 Quarantine https://t.co/ApNQSBigtz via @lovelin_paul,2020-04-07 20:04:30,,positive
1247616260189241344,mmolaro,Shout out to @SMCHealth for updating their data reporting for covid-19 to be a @MSPowerBI embedded report. Very nice (https://t.co/iIqmUfvUgh) #powerbi,2020-04-07 20:04:30,,positive
1247616260327833603,CassieMaie,"Spoke to my cousin earlier who bakes cakes for a living. Despite no eggs, &amp; flour being in shops, she’s STILL receiving orders for CAKES!? 

So people plan to eat themselves into oblivion in this quarantine then?🤷🏽‍♀️🤣",2020-04-07 20:04:30,,neutral
1247616261216927744,barbaraemiller,Key Trump task force must work remotely after positive COVID-19 test https://t.co/Ab1ZYK92ro via @nbcnews,2020-04-07 20:04:30,,neutral
1247616261657448453,Cernovich,Biggest shift post coronavirus will be __________,2020-04-07 20:04:31,,neutral
1247616261674217472,CrossonKadie,The only good thing about this quarantine is not having to wear makeup 🙌🏻,2020-04-07 20:04:31,,positive
1247616261795786752,tehya_j,Quarantine getting 2016ish https://t.co/knPCMsWUW9,2020-04-07 20:04:31,United States,neutral
1247616264501108738,NorthCounty_LRS,"F.A.Q. on #Coronavirus Relief for #SmallBusinesses, #Freelancers and More https://t.co/KqttAvRrzL",2020-04-07 20:04:31,,neutral
1247616264815738881,AlvanJenkins,LMAOOOO Tory Lanez brought girls and bottles of alcohol to his place on Quarantine Radio 🤣🤣🤣🤣🤣🤣🤣,2020-04-07 20:04:31,,neutral
1247616265096695815,LinwoodRon,All y’all people coming up with these weird ass coronavirus theories weird,2020-04-07 20:04:31,,negative
1247616265251966977,mslibrty,Some Coronavirus Patients Show Signs of Brain Ailments https://t.co/MLdhvk9R0C,2020-04-07 20:04:31,,negative
1247616265914630144,ovoairam,Tory is livest nigga on the internet right now lmfaooo this man brought a bottle girl for quarantine radio,2020-04-07 20:04:32,,neutral
1247616265491005440,Jodafunk_SA,Quarantine got a nigga light skinned https://t.co/yoV8pl6kbS,2020-04-07 20:04:31,,neutral
1247616266690367488,cyberdean07,"Unbeknownst to many, San Roque is the patron saint and protector against pandemic 

https://t.co/uelRJFx5v3 via @rapplerdotcom",2020-04-07 20:04:32,,neutral
1247616268573839366,badgalTI__,Tory Lanez brought out bottle girls at his Quarantine Club 🤣,2020-04-07 20:04:32,,neutral
1247616268712079360,valentin0rie2,"Via @euronews: Live: France’s COVID-19 death toll rises by more than 1,400 and passes 10,000 mark
https://t.co/SzBvEO0141",2020-04-07 20:04:32,,negative
1247616268884049920,SandyBeachesAkl,Coronavirus: Marist cluster members initally refused tests https://t.co/o0zfbpqy3R,2020-04-07 20:04:32,,negative
1247616269089509376,lmaogizzelle,This quarantine is dookie water.,2020-04-07 20:04:32,,neutral
1247616269010026496,ActionRspca,Warning: extremely distressing content. #Animals caged &amp; abandoned https://t.co/UPS34wVM52 #coronavirus #TuesdayThoughts,2020-04-07 20:04:32,,negative
1247616269454434305,idontfuckloserz,all i have to be proud of during this quarantine is these victory royale streaks im gettin,2020-04-07 20:04:32,,positive
1247616269257289728,DeidreEversull,"https://t.co/q2UX0xAzo3: Trump’s coronavirus failure came from overconfidence. Kushner’s and Navarro’s, too..
https://t.co/tRGzYJF0RF

via @GoogleNews",2020-04-07 20:04:32,,negative
1247616269471244288,Britthawks,Ripped out my fake eyelashes since my salon is closed and I can’t get them done. This quarantine is not treating me great and now I look ugly,2020-04-07 20:04:32,,negative
1247616269722873856,ChristerEricson,"If only it would infect utter dumbasses only.
https://t.co/PqHFioxg0m",2020-04-07 20:04:32,,neutral
1247616269932691456,CRSOKtulsa,Oklahoma's mental health commissioner shares some specific ways we can help alleviate our stress and our children's anxiety amid the coronavirus (COVID-19) pandemic. https://t.co/qdhtpkBWTk https://t.co/AJcdscjC6v,2020-04-07 20:04:32,,positive
1247616272595972097,snapdocs,"Greg Russell, Our Head of Talent and People, talked with @BuiltInColorado about what leadership looks like in times of uncertainty.  

https://t.co/88IIERbQ8V

#culture #fintech #HIRINGNOW #digitalmortgage",2020-04-07 20:04:33,,neutral
1247616273296633861,AlistairHaimes,"For people trying to make sense of UK data, tracking covid-19 inpatients might be the best data we have.
https://t.co/kxAjJTRZmt",2020-04-07 20:04:33,,neutral
1247616274299072514,megdi_official,quarantine radio has bottlegirls hahahahaha,2020-04-07 20:04:34,,neutral
1247616276958248960,Beyondnae,This quarantine gotta end soon cause all y’all think y’all are designers,2020-04-07 20:04:34,,neutral
1247616276672864256,SpokenEmpire,Adapting Small Business to COVID-19 FourTen Creative Digital Marketing https://t.co/MOPTW5TDPM https://t.co/99b6PAV2Yj,2020-04-07 20:04:34,,positive
1247616276966629390,AhmadRahnamoon,@sciencecohen read your latest article on Covid-19 vaccine race. Enjoyed it alot. Very very broad and thoughtful.,2020-04-07 20:04:34,,positive
1247616276362604548,BHolmesDev,"My quarantine blog-a-thon is officially a *go* 🏃‍♂️
First post: how I made this cool image carousel with less than 30 lines of code using @sveltejs. It's beefy, but full of helpful GIFs and code sandboxes if you want to skim! #DEVcommunity https://t.co/mn16Gw69Rp https://t.co/gc7zp76Yji",2020-04-07 20:04:34,,neutral
1247616277532889088,Weaselu_,how are you spending your quarantine? I go back to work on Thursday and i am nooot looking forward to it https://t.co/IBQD1ejomv,2020-04-07 20:04:34,,neutral
